{
  "schema": "campaigns-os-runtime-recipe/v1",
  "recipe_kind": "campaigns-os-node-v1",
  "recipe_revision": "1.0.3",
  "refusal_reason_code": "runtime_recipe_refused",
  "fail_closed": true,
  "unperformable_check_disposition": "failed",
  "preconditions": {
    "target_oid_resolved": true,
    "lockfile_present": true,
    "clean_staging_generation": true,
    "input_fingerprint_recorded": true
  },
  "tooling": {
    "node": {
      "range": ">=20.19.0 <25",
      "min_inclusive": "20.19.0",
      "max_exclusive": "25.0.0",
      "verified": [
        "22.23.1"
      ],
      "applies_to": "The Node runtime executing both steps and, afterwards, the prepared generation.",
      "rationale": "The lower bound is the target's own declared minimum. The upper bound is the recipe's, not the target's: the target declares an open-ended minimum, and an open-ended range is not a bound. Delegating the ceiling to the checkout under evaluation would let that checkout widen the accepted runtime of the consumer evaluating it. Qualifying a new Node major is a one-line revision plus a ledger entry, which is the intended cost."
    },
    "npm": {
      "range": "10 || 11",
      "min_inclusive": "10.0.0",
      "max_exclusive": "12.0.0",
      "accepted_majors": [
        10,
        11
      ],
      "verified": [
        "10.9.8",
        "11.19.1"
      ],
      "applies_to": "The package manager executing the install and build steps.",
      "rationale": "Both majors were run end to end against this recipe and produced byte-identical output, and together they are exactly the set that supported Node release lines ship by default. Later majors are opt-in installs rather than what the ecosystem is running, so they stay outside the range until a Node line bundles one; that trigger is an external fact rather than a taste call."
    },
    "target_engines": {
      "field": "engines.node",
      "observed": ">=20.19.0",
      "_note": "The exact value this revision was authored against. A consumer compares the target's live value to this string and refuses on any difference, per on_disagreement. That is deliberately strict: a widened engines range in the target is precisely the silent widening this contract exists to catch, and re-agreeing is a one-line revision."
    },
    "on_disagreement": "refuse"
  },
  "network": {
    "cache_ownership": "consumer_profile",
    "inherit_proxy": false,
    "inherit_credentials": false,
    "inherit_npmrc": false,
    "per_step": {
      "install": {
        "policy": "allowlist",
        "hosts": [
          "registry.npmjs.org"
        ],
        "integrity_source": "package-lock.json (lockfileVersion 3, per-package integrity digests)",
        "rationale": "The install step is the only step that needs bytes it does not already have, and it needs them from exactly one place. Measured cold-cache install is a few seconds, so the network window is small. The cache is an optimisation and never a correctness input: an offline-after-warm policy would make a stale or poisoned cache silently change what gets built, with no fetch left to catch it. Note that `args` above carries no registry flag — the consumer is responsible for setting the package manager's registry to this host in the process environment before invoking that argv, and for refusing any inherited npmrc, proxy, or credential configuration that could redirect it. Combined with `--ignore-scripts`, nothing that runs during install is third-party code that could disregard the setting. The integrity digests remain the independent second bound, which is what makes a redirected or substituted byte stream fail even if the first bound were evaded."
      },
      "build": {
        "policy": "deny",
        "hosts": [],
        "rationale": "The build step is a local type-directed compile and needs no network at all. Declaring that turns an assumption into a check. As with install, `args` above carries no offline flag — the consumer puts the package manager into offline mode through the process environment it constructs for this step. `tsc` opens no sockets of its own, and `--ignore-scripts` keeps pre/post hooks from introducing any."
      }
    }
  },
  "steps": [
    {
      "id": "install",
      "executable": "npm",
      "args": [
        "ci",
        "--ignore-scripts",
        "--no-audit",
        "--fund=false"
      ],
      "cwd": "target_root",
      "stdin": "closed",
      "lifecycle_scripts": "disabled",
      "timeout_bound": "install_seconds",
      "rationale": "ci rather than install, so the lockfile is authoritative and the tree is reproducible. --ignore-scripts is the load-bearing flag: it suppresses every dependency lifecycle script and the target's own prepare. No dependency in the resolved tree declares an install script. The exact list in target_expectations remains a reviewed expectation: additions and removals require a recipe revision, so existing v1 consumers retain the same agreement semantics. --no-audit and --fund=false remove two network- and output-side effects that are not part of preparing a runtime."
    },
    {
      "id": "build",
      "executable": "npm",
      "args": [
        "run",
        "--ignore-scripts",
        "build:spec"
      ],
      "cwd": "target_root",
      "stdin": "closed",
      "lifecycle_scripts": "disabled",
      "timeout_bound": "build_seconds",
      "rationale": "Not redundant with the install step. Because install runs with lifecycle scripts disabled, the target's prepare script does not fire and the output directory is absent afterwards; this step is the only thing that builds the runtime under the recipe's own flags. --ignore-scripts here means the named script runs while its pre and post siblings do not, so the build is exactly one contracted command rather than an open-ended chain the target can extend."
    }
  ],
  "inputs": {
    "_note": "The complete input set, enumerated explicitly rather than globbed. The compiler's configured include globs are NOT the input set: two root modules enter the compilation transitively through imports from the entry module and are emitted, so a fingerprint derived from the globs would cover 36 of the 38 compiled sources and miss one of the larger emitted surfaces. Test fixtures and the package's own tests are not inputs; nothing under them is emitted. A checker resolves the compiler's actual file list and asserts it equals this enumeration, so this list cannot rot silently.",
    "fingerprint_algorithm": "sha256",
    "files": [
      "campaign-spec/analytics-vocabulary.ts",
      "campaign-spec/checkout-flow.ts",
      "campaign-spec/index.ts",
      "campaign-spec/normalize.ts",
      "campaign-spec/package.json",
      "campaign-spec/routing.ts",
      "campaign-spec/rules/analytics-contract-shape.ts",
      "campaign-spec/rules/assembly-hints-shape.ts",
      "campaign-spec/rules/campaign-metadata.ts",
      "campaign-spec/rules/checkout-forward-target.ts",
      "campaign-spec/rules/checkout-has-success-url.ts",
      "campaign-spec/rules/checkout-path-has-packages.ts",
      "campaign-spec/rules/checkout-step-reaches-checkout.ts",
      "campaign-spec/rules/cycle-detection.ts",
      "campaign-spec/rules/design-source-shape.ts",
      "campaign-spec/rules/downsell-without-upsell.ts",
      "campaign-spec/rules/exit-intent-validation.ts",
      "campaign-spec/rules/funnel-count.ts",
      "campaign-spec/rules/funnel-hypothesis-length.ts",
      "campaign-spec/rules/funnel-identity.ts",
      "campaign-spec/rules/funnel-weight-sum.ts",
      "campaign-spec/rules/index.ts",
      "campaign-spec/rules/offer-ref-integrity.ts",
      "campaign-spec/rules/one-checkout-per-path.ts",
      "campaign-spec/rules/package-pricing-sanity.ts",
      "campaign-spec/rules/page-count.ts",
      "campaign-spec/rules/page-id-uniqueness.ts",
      "campaign-spec/rules/pre-payment-forward-target.ts",
      "campaign-spec/rules/promo-code-input-validation.ts",
      "campaign-spec/rules/promo-codes-shape.ts",
      "campaign-spec/rules/route-field-ignored-for-page-type.ts",
      "campaign-spec/rules/route-target-resolves.ts",
      "campaign-spec/rules/schema-version.ts",
      "campaign-spec/rules/sdk-version.ts",
      "campaign-spec/rules/shipping-countries-shape.ts",
      "campaign-spec/rules/shipping-methods-present.ts",
      "campaign-spec/rules/store-profile-shape.ts",
      "campaign-spec/rules/thank-you-requirement.ts",
      "campaign-spec/rules/unknown-top-level-fields.ts",
      "campaign-spec/rules/upsell-has-packages.ts",
      "campaign-spec/rules/upsell-routing-complete.ts",
      "campaign-spec/rules/upsell-without-checkout.ts",
      "campaign-spec/rules/variant-labels-shape.ts",
      "campaign-spec/sdk-version-parse.ts",
      "campaign-spec/tsconfig.build.json",
      "campaign-spec/types.ts",
      "package-lock.json",
      "package.json"
    ]
  },
  "outputs": {
    "_note": "The output directory is a build product. It is untracked and git-ignored, no committed copy exists, and the copy in a published tarball exists only because packing runs the prepare script. There is therefore no baseline hash for its CONTENTS that this repository could publish, and any acceptance criterion phrased as 'output matches expected hashes' is not implementable as written. Verification is self-consistency instead: the inventory is complete and has nothing extra, the recorded hashes still hold, the entry module imports, the type entry is present, and the inputs that produced the output still match the inputs at the target commit. The build is deterministic — independent clean checkouts at one commit produce byte-identical output, and the compiler config emits neither source maps nor declaration maps, so no absolute paths or timestamps are embedded — which is what makes content hashing a sound strategy rather than a hopeful one.",
    "directory": "campaign-spec/dist",
    "committed": false,
    "module_source_root": "campaign-spec/",